================================================
   ZK-SNARK Trusted Setup (Groth16)
================================================

[2026-01-16 10:59:42] Setup started
[2026-01-16 10:59:42] Setup started
[2026-01-16 10:59:42] Log file: zkproof/logs/setup_20260116_105942.log
[2026-01-16 10:59:42] Log file: zkproof/logs/setup_20260116_105942.log

[2026-01-16 10:59:42] Checking snarkjs installation...
[2026-01-16 10:59:42] Checking snarkjs installation...
[2026-01-16 10:59:42] [0;32m✓ snarkjs found: snarkjs@0.7.5
        Copyright (C) 2018  0kims association
        This program comes with ABSOLUTELY NO WARRANTY;
        This is free software, and you are welcome to redistribute it
        under certain conditions; see the COPYING file in the official
        repo directory at  https://github.com/iden3/snarkjs 

Usage:
        snarkjs <full command> ...  <options>
   or   snarkjs <shortcut> ...  <options>

Type snarkjs <command> --help to get more information for that command

Full Command                  Description
============                  =================
powersoftau new               Starts a powers of tau ceremony
     Usage:  snarkjs ptn <curve> <power> [powersoftau_0000.ptau]
powersoftau contribute        creates a ptau file with a new contribution
     Usage:  snarkjs ptc <powersoftau.ptau> <new_powersoftau.ptau>
powersoftau export challenge  Creates a challenge
     Usage:  snarkjs ptec <powersoftau_0000.ptau> [challenge]
powersoftau challenge contributeContribute to a challenge
     Usage:  snarkjs ptcc <curve> <challenge> [response]
powersoftau import response   import a response to a ptau file
     Usage:  snarkjs ptir <powersoftau_old.ptau> <response> <<powersoftau_new.ptau>
powersoftau beacon            adds a beacon
     Usage:  snarkjs ptb <old_powersoftau.ptau> <new_powersoftau.ptau> <beaconHash(Hex)> <numIterationsExp>
powersoftau prepare phase2    Prepares phase 2. 
     Usage:  snarkjs pt2 <powersoftau.ptau> <new_powersoftau.ptau>
powersoftau convert           Convert ptau
     Usage:  snarkjs ptcv <old_powersoftau.ptau> <new_powersoftau.ptau>
powersoftau truncate          Generate different powers of tau with smaller sizes 
     Usage:  snarkjs ptt <powersoftau.ptau>
powersoftau verify            verifies a powers of tau file
     Usage:  snarkjs ptv <powersoftau.ptau>
powersoftau export json       Exports a power of tau file to a JSON
     Usage:  snarkjs ptej <powersoftau_0000.ptau> <powersoftau_0000.json>
r1cs info                     Print statistiscs of a circuit
     Usage:  snarkjs ri [circuit.r1cs]
r1cs print                    Print the constraints of a circuit
     Usage:  snarkjs rp [circuit.r1cs] [circuit.sym]
r1cs export json              Export r1cs to JSON file
     Usage:  snarkjs rej [circuit.r1cs] [circuit.json]
wtns calculate                Caclculate specific witness of a circuit given an input
     Usage:  snarkjs wc [circuit.wasm] [input.json] [witness.wtns]
wtns debug                    Calculate the witness with debug info.
     Usage:  snarkjs wd [circuit.wasm] [input.json] [witness.wtns] [circuit.sym]
wtns export json              Calculate the witness with debug info.
     Usage:  snarkjs wej [witness.wtns] [witnes.json]
wtns check                    Check if a specific witness of a circuit fulfills the r1cs constraints
     Usage:  snarkjs wchk [circuit.r1cs] [[witness.wtns]
zkey contribute               creates a zkey file with a new contribution
     Usage:  snarkjs zkc <circuit_old.zkey> <circuit_new.zkey>
zkey export bellman           Export a zKey to a MPCParameters file compatible with kobi/phase2 (Bellman)
     Usage:  snarkjs zkeb <circuit_xxxx.zkey> [circuit.mpcparams]
zkey bellman contribute       contributes to a challenge file in bellman format
     Usage:  snarkjs zkbc <curve> <circuit.mpcparams> <circuit_response.mpcparams>
zkey import bellman           Export a zKey to a MPCParameters file compatible with kobi/phase2 (Bellman) 
     Usage:  snarkjs zkib <circuit_old.zkey> <circuit.mpcparams> <circuit_new.zkey>
zkey beacon                   adds a beacon
     Usage:  snarkjs zkb <circuit_old.zkey> <circuit_new.zkey> <beaconHash(Hex)> <numIterationsExp>
zkey verify r1cs              Verify zkey file contributions and verify that matches with the original circuit.r1cs and ptau
     Usage:  snarkjs zkv [circuit.r1cs] [powersoftau.ptau] [circuit_final.zkey]
zkey verify init              Verify zkey file contributions and verify that matches with the original circuit.r1cs and ptau
     Usage:  snarkjs zkvi [circuit_0000.zkey] [powersoftau.ptau] [circuit_final.zkey]
zkey export verificationkey   Exports a verification key
     Usage:  snarkjs zkev [circuit_final.zkey] [verification_key.json]
zkey export json              Exports a circuit key to a JSON file
     Usage:  snarkjs zkej [circuit_final.zkey] [circuit_final.zkey.json]
zkey export solidityverifier  Creates a verifier in solidity
     Usage:  snarkjs zkesv [circuit_final.zkey] [verifier.sol]
zkey export soliditycalldata  Generates call parameters ready to be called.
     Usage:  snarkjs zkesc [public.json] [proof.json]
groth16 setup                 Creates an initial groth16 pkey file with zero contributions
     Usage:  snarkjs g16s [circuit.r1cs] [powersoftau.ptau] [circuit_0000.zkey]
groth16 prove                 Generates a zk Proof from witness
     Usage:  snarkjs g16p [circuit_final.zkey] [witness.wtns] [proof.json] [public.json]
groth16 fullprove             Generates a zk Proof from input
     Usage:  snarkjs g16f [input.json] [circuit_final.wasm] [circuit_final.zkey] [proof.json] [public.json]
groth16 verify                Verify a zk Proof
     Usage:  snarkjs g16v [verification_key.json] [public.json] [proof.json]
plonk setup                   Creates an initial PLONK pkey 
     Usage:  snarkjs pks [circuit.r1cs] [powersoftau.ptau] [circuit.zkey]
plonk prove                   Generates a PLONK Proof from witness
     Usage:  snarkjs pkp [circuit.zkey] [witness.wtns] [proof.json] [public.json]
plonk fullprove               Generates a PLONK Proof from input
     Usage:  snarkjs pkf [input.json] [circuit.wasm] [circuit.zkey] [proof.json] [public.json]
plonk verify                  Verify a PLONK Proof
     Usage:  snarkjs pkv [verification_key.json] [public.json] [proof.json]
fflonk setup                  BETA version. Creates a FFLONK zkey from a circuit
     Usage:  snarkjs ffs [circuit.r1cs] [powersoftau.ptau] [circuit.zkey]
fflonk prove                  BETA version. Generates a FFLONK Proof from witness
     Usage:  snarkjs ffp [circuit.zkey] [witness.wtns] [proof.json] [public.json]
fflonk fullprove              BETA version. Generates a witness and the FFLONK Proof in the same command
     Usage:  snarkjs fff [witness.json] [circuit.wasm] [circuit.zkey] [proof.json] [public.json]
fflonk verify                 BETA version. Verify a FFLONK Proof
     Usage:  snarkjs ffv [verification_key.json] [public.json] [proof.json]
file info                     Check info of a binary file
     Usage:  snarkjs fi [binary.file]
unknown[0m
[2026-01-16 10:59:42] [0;32m✓ snarkjs found: snarkjs@0.7.5
        Copyright (C) 2018  0kims association
        This program comes with ABSOLUTELY NO WARRANTY;
        This is free software, and you are welcome to redistribute it
        under certain conditions; see the COPYING file in the official
        repo directory at  https://github.com/iden3/snarkjs 

Usage:
        snarkjs <full command> ...  <options>
   or   snarkjs <shortcut> ...  <options>

Type snarkjs <command> --help to get more information for that command

Full Command                  Description
============                  =================
powersoftau new               Starts a powers of tau ceremony
     Usage:  snarkjs ptn <curve> <power> [powersoftau_0000.ptau]
powersoftau contribute        creates a ptau file with a new contribution
     Usage:  snarkjs ptc <powersoftau.ptau> <new_powersoftau.ptau>
powersoftau export challenge  Creates a challenge
     Usage:  snarkjs ptec <powersoftau_0000.ptau> [challenge]
powersoftau challenge contributeContribute to a challenge
     Usage:  snarkjs ptcc <curve> <challenge> [response]
powersoftau import response   import a response to a ptau file
     Usage:  snarkjs ptir <powersoftau_old.ptau> <response> <<powersoftau_new.ptau>
powersoftau beacon            adds a beacon
     Usage:  snarkjs ptb <old_powersoftau.ptau> <new_powersoftau.ptau> <beaconHash(Hex)> <numIterationsExp>
powersoftau prepare phase2    Prepares phase 2. 
     Usage:  snarkjs pt2 <powersoftau.ptau> <new_powersoftau.ptau>
powersoftau convert           Convert ptau
     Usage:  snarkjs ptcv <old_powersoftau.ptau> <new_powersoftau.ptau>
powersoftau truncate          Generate different powers of tau with smaller sizes 
     Usage:  snarkjs ptt <powersoftau.ptau>
powersoftau verify            verifies a powers of tau file
     Usage:  snarkjs ptv <powersoftau.ptau>
powersoftau export json       Exports a power of tau file to a JSON
     Usage:  snarkjs ptej <powersoftau_0000.ptau> <powersoftau_0000.json>
r1cs info                     Print statistiscs of a circuit
     Usage:  snarkjs ri [circuit.r1cs]
r1cs print                    Print the constraints of a circuit
     Usage:  snarkjs rp [circuit.r1cs] [circuit.sym]
r1cs export json              Export r1cs to JSON file
     Usage:  snarkjs rej [circuit.r1cs] [circuit.json]
wtns calculate                Caclculate specific witness of a circuit given an input
     Usage:  snarkjs wc [circuit.wasm] [input.json] [witness.wtns]
wtns debug                    Calculate the witness with debug info.
     Usage:  snarkjs wd [circuit.wasm] [input.json] [witness.wtns] [circuit.sym]
wtns export json              Calculate the witness with debug info.
     Usage:  snarkjs wej [witness.wtns] [witnes.json]
wtns check                    Check if a specific witness of a circuit fulfills the r1cs constraints
     Usage:  snarkjs wchk [circuit.r1cs] [[witness.wtns]
zkey contribute               creates a zkey file with a new contribution
     Usage:  snarkjs zkc <circuit_old.zkey> <circuit_new.zkey>
zkey export bellman           Export a zKey to a MPCParameters file compatible with kobi/phase2 (Bellman)
     Usage:  snarkjs zkeb <circuit_xxxx.zkey> [circuit.mpcparams]
zkey bellman contribute       contributes to a challenge file in bellman format
     Usage:  snarkjs zkbc <curve> <circuit.mpcparams> <circuit_response.mpcparams>
zkey import bellman           Export a zKey to a MPCParameters file compatible with kobi/phase2 (Bellman) 
     Usage:  snarkjs zkib <circuit_old.zkey> <circuit.mpcparams> <circuit_new.zkey>
zkey beacon                   adds a beacon
     Usage:  snarkjs zkb <circuit_old.zkey> <circuit_new.zkey> <beaconHash(Hex)> <numIterationsExp>
zkey verify r1cs              Verify zkey file contributions and verify that matches with the original circuit.r1cs and ptau
     Usage:  snarkjs zkv [circuit.r1cs] [powersoftau.ptau] [circuit_final.zkey]
zkey verify init              Verify zkey file contributions and verify that matches with the original circuit.r1cs and ptau
     Usage:  snarkjs zkvi [circuit_0000.zkey] [powersoftau.ptau] [circuit_final.zkey]
zkey export verificationkey   Exports a verification key
     Usage:  snarkjs zkev [circuit_final.zkey] [verification_key.json]
zkey export json              Exports a circuit key to a JSON file
     Usage:  snarkjs zkej [circuit_final.zkey] [circuit_final.zkey.json]
zkey export solidityverifier  Creates a verifier in solidity
     Usage:  snarkjs zkesv [circuit_final.zkey] [verifier.sol]
zkey export soliditycalldata  Generates call parameters ready to be called.
     Usage:  snarkjs zkesc [public.json] [proof.json]
groth16 setup                 Creates an initial groth16 pkey file with zero contributions
     Usage:  snarkjs g16s [circuit.r1cs] [powersoftau.ptau] [circuit_0000.zkey]
groth16 prove                 Generates a zk Proof from witness
     Usage:  snarkjs g16p [circuit_final.zkey] [witness.wtns] [proof.json] [public.json]
groth16 fullprove             Generates a zk Proof from input
     Usage:  snarkjs g16f [input.json] [circuit_final.wasm] [circuit_final.zkey] [proof.json] [public.json]
groth16 verify                Verify a zk Proof
     Usage:  snarkjs g16v [verification_key.json] [public.json] [proof.json]
plonk setup                   Creates an initial PLONK pkey 
     Usage:  snarkjs pks [circuit.r1cs] [powersoftau.ptau] [circuit.zkey]
plonk prove                   Generates a PLONK Proof from witness
     Usage:  snarkjs pkp [circuit.zkey] [witness.wtns] [proof.json] [public.json]
plonk fullprove               Generates a PLONK Proof from input
     Usage:  snarkjs pkf [input.json] [circuit.wasm] [circuit.zkey] [proof.json] [public.json]
plonk verify                  Verify a PLONK Proof
     Usage:  snarkjs pkv [verification_key.json] [public.json] [proof.json]
fflonk setup                  BETA version. Creates a FFLONK zkey from a circuit
     Usage:  snarkjs ffs [circuit.r1cs] [powersoftau.ptau] [circuit.zkey]
fflonk prove                  BETA version. Generates a FFLONK Proof from witness
     Usage:  snarkjs ffp [circuit.zkey] [witness.wtns] [proof.json] [public.json]
fflonk fullprove              BETA version. Generates a witness and the FFLONK Proof in the same command
     Usage:  snarkjs fff [witness.json] [circuit.wasm] [circuit.zkey] [proof.json] [public.json]
fflonk verify                 BETA version. Verify a FFLONK Proof
     Usage:  snarkjs ffv [verification_key.json] [public.json] [proof.json]
file info                     Check info of a binary file
     Usage:  snarkjs fi [binary.file]
unknown[0m
[2026-01-16 10:59:42] snarkjs path: /Users/mahyardaneshpajooh/Desktop/TeleportDAO/teleswap-contracts/node_modules/.bin/snarkjs
[2026-01-16 10:59:42] snarkjs path: /Users/mahyardaneshpajooh/Desktop/TeleportDAO/teleswap-contracts/node_modules/.bin/snarkjs

[2026-01-16 10:59:42] Determining paths...
[2026-01-16 10:59:42] Determining paths...
[2026-01-16 10:59:42] Running from circuits directory
[2026-01-16 10:59:42] Running from circuits directory
[2026-01-16 10:59:42] BUILD_DIR: ../zkproof/build
[2026-01-16 10:59:42] BUILD_DIR: ../zkproof/build
[2026-01-16 10:59:42] PTAU_DIR: ../zkproof/build/ptau
[2026-01-16 10:59:42] PTAU_DIR: ../zkproof/build/ptau
[2026-01-16 10:59:42] Checking for compiled circuit...
[2026-01-16 10:59:42] Checking for compiled circuit...
[2026-01-16 10:59:42] [0;32m✓ Circuit found: ../zkproof/build/main.r1cs (28215128 bytes)[0m
[2026-01-16 10:59:42] [0;32m✓ Circuit found: ../zkproof/build/main.r1cs (28215128 bytes)[0m
[2026-01-16 10:59:42] Created/verified PTAU directory: ../zkproof/build/ptau
[2026-01-16 10:59:42] Created/verified PTAU directory: ../zkproof/build/ptau

[2026-01-16 10:59:42] [1;33mThis is a DEVELOPMENT setup - NOT for production use[0m
[2026-01-16 10:59:42] [1;33mThis is a DEVELOPMENT setup - NOT for production use[0m
For production, use a multi-party ceremony with proper security

Continue with development setup? (y/n) 

================================================
   Phase 1: Powers of Tau Ceremony
================================================

[2026-01-16 10:59:44] Phase 1 started
[2026-01-16 10:59:44] Phase 1 started
[2026-01-16 10:59:44] Getting circuit info...
[2026-01-16 10:59:44] Getting circuit info...
[2026-01-16 10:59:44] [CMD] snarkjs r1cs info ../zkproof/build/main.r1cs
[2026-01-16 10:59:44] [CMD] snarkjs r1cs info ../zkproof/build/main.r1cs
[32;22m[INFO]  [39;1msnarkJS[0m: Curve: bn-128
[32;22m[INFO]  [39;1msnarkJS[0m: # of Wires: 126311
[32;22m[INFO]  [39;1msnarkJS[0m: # of Constraints: 126193
[32;22m[INFO]  [39;1msnarkJS[0m: # of Private Inputs: 12301
[32;22m[INFO]  [39;1msnarkJS[0m: # of Public Inputs: 6
[32;22m[INFO]  [39;1msnarkJS[0m: # of Labels: 841000
[32;22m[INFO]  [39;1msnarkJS[0m: # of Outputs: 0
[32;22m[INFO]  [39;1msnarkJS[0m: Curve: bn-128
[32;22m[INFO]  [39;1msnarkJS[0m: # of Wires: 126311
[32;22m[INFO]  [39;1msnarkJS[0m: # of Constraints: 126193
[32;22m[INFO]  [39;1msnarkJS[0m: # of Private Inputs: 12301
[32;22m[INFO]  [39;1msnarkJS[0m: # of Public Inputs: 6
[32;22m[INFO]  [39;1msnarkJS[0m: # of Labels: 841000
[32;22m[INFO]  [39;1msnarkJS[0m: # of Outputs: 0
[2026-01-16 10:59:45] Circuit has 126193 constraints
[2026-01-16 10:59:45] Circuit has 126193 constraints
[2026-01-16 10:59:45] Using power of tau: 17 (supports up to 131072 constraints)
[2026-01-16 10:59:45] Using power of tau: 17 (supports up to 131072 constraints)

[2026-01-16 10:59:45] PTAU file path: ../zkproof/build/ptau/pot17_final.ptau
[2026-01-16 10:59:45] PTAU file path: ../zkproof/build/ptau/pot17_final.ptau
[2026-01-16 10:59:45] [1;33mChecking existing Powers of Tau file (150997957 bytes)...[0m
[2026-01-16 10:59:45] [1;33mChecking existing Powers of Tau file (150997957 bytes)...[0m
[2026-01-16 10:59:45] [CMD] snarkjs powersoftau verify ../zkproof/build/ptau/pot17_final.ptau
[2026-01-16 10:59:45] [CMD] snarkjs powersoftau verify ../zkproof/build/ptau/pot17_final.ptau
[32;22m[INFO]  [39;1msnarkJS[0m: Powers Of tau file OK!
[32;22m[INFO]  [39;1msnarkJS[0m: Next challenge hash: 
		c65b273b 5e9978bf 3a497f51 3cded4fa
		ad65b8e2 3c6ca520 de171ce9 ce57f665
		4c7885eb bc075af0 63047188 ce69db1d
		e16b4098 429daec9 0202c023 eeea8b6d
[32;22m[INFO]  [39;1msnarkJS[0m: -----------------------------------------------------
[32;22m[INFO]  [39;1msnarkJS[0m: Contribution #2: Final Beacon
[32;22m[INFO]  [39;1msnarkJS[0m: Next Challenge: 
		c65b273b 5e9978bf 3a497f51 3cded4fa
		ad65b8e2 3c6ca520 de171ce9 ce57f665
		4c7885eb bc075af0 63047188 ce69db1d
		e16b4098 429daec9 0202c023 eeea8b6d
[32;22m[INFO]  [39;1msnarkJS[0m: Response Hash:
		36cd05ba a9b6fe24 e6858c80 ed94f7a1
		bdee948b e574d991 c3bc3425 bd4dbfdc
		ac213fac c74803d2 6c6eefb9 3d84ee71
		5d35a378 1d600418 394d003b c2d85671
[32;22m[INFO]  [39;1msnarkJS[0m: Response Hash:
		81fdbc6f 53487f74 918cf5b8 8b366c21
		ec42baf7 7ad6b297 8ba86b22 82bf95f8
		36aaec99 0111e408 c2f1d1d1 6314cb8a
		44aa9624 1c858f78 641df240 8d1eff84
[32;22m[INFO]  [39;1msnarkJS[0m: Beacon generator: 0102030405060708090a0b0c0d0e0f101112131415161718191a1b1c1d1e1f
[32;22m[INFO]  [39;1msnarkJS[0m: Beacon iterations Exp: 10
[32;22m[INFO]  [39;1msnarkJS[0m: Powers Of tau file OK!
[32;22m[INFO]  [39;1msnarkJS[0m: -----------------------------------------------------
[32;22m[INFO]  [39;1msnarkJS[0m: Contribution #1: First contribution
[32;22m[INFO]  [39;1msnarkJS[0m: Next Challenge: 
		81fdbc6f 53487f74 918cf5b8 8b366c21
		ec42baf7 7ad6b297 8ba86b22 82bf95f8
		36aaec99 0111e408 c2f1d1d1 6314cb8a
		44aa9624 1c858f78 641df240 8d1eff84
[32;22m[INFO]  [39;1msnarkJS[0m: Response Hash:
		aa3b7002 41dcf9c4 320830c1 73814e8c
		28fccbd5 0b3ac951 8234fd14 aab0fb69
		6dfe6c57 eaaf4560 e4814d03 380d470f
		93254534 f9aa72b6 9b9d80e9 41e43c58
[32;22m[INFO]  [39;1msnarkJS[0m: Response Hash:
		d27bebee 8c0abf50 66dd8742 fa7de8c4
		54bea04a 8afad209 d51f58ec 16bcea9e
		02b2774d 6d408b4a 71af1986 203a7ed7
		d9d2d6d5 fb7c5318 b8d58183 a15b9706
[32;22m[INFO]  [39;1msnarkJS[0m: -----------------------------------------------------
[32;22m[INFO]  [39;1msnarkJS[0m: Powers of Tau Ok!
[2026-01-16 11:00:15] [0;32m✓ Powers of Tau file exists and is valid[0m
[2026-01-16 11:00:15] [0;32m✓ Powers of Tau file exists and is valid[0m
[2026-01-16 11:00:15]   ../zkproof/build/ptau/pot17_final.ptau
[2026-01-16 11:00:15]   ../zkproof/build/ptau/pot17_final.ptau
[2026-01-16 11:00:15] Phase 1 completed
[2026-01-16 11:00:15] Phase 1 completed

================================================
   Phase 2: Circuit-Specific Setup
================================================

[2026-01-16 11:00:15] Phase 2 started
[2026-01-16 11:00:15] Phase 2 started
[2026-01-16 11:00:15] zkey file does not exist, will generate
[2026-01-16 11:00:15] zkey file does not exist, will generate
[2026-01-16 11:00:15] [1;33mStep 2.1: Generating zkey (proving key)...[0m
[2026-01-16 11:00:15] [1;33mStep 2.1: Generating zkey (proving key)...[0m
[2026-01-16 11:00:15] [1;33m⚠ WARNING: This may take 2+ hours for 126193 constraints[0m
[2026-01-16 11:00:15] [1;33m⚠ WARNING: This may take 2+ hours for 126193 constraints[0m
[2026-01-16 11:00:15] [1;33m   This is CPU-intensive and will use significant CPU[0m
[2026-01-16 11:00:15] [1;33m   This is CPU-intensive and will use significant CPU[0m
[2026-01-16 11:00:15] 
[2026-01-16 11:00:15] 
[2026-01-16 11:00:15] [0;34mStarting zkey generation process...[0m
[2026-01-16 11:00:15] [0;34mStarting zkey generation process...[0m
[2026-01-16 11:00:15] Output file: ../zkproof/build/circuit_0000.zkey
[2026-01-16 11:00:15] Output file: ../zkproof/build/circuit_0000.zkey
[2026-01-16 11:00:15] Input R1CS: ../zkproof/build/main.r1cs
[2026-01-16 11:00:15] Input R1CS: ../zkproof/build/main.r1cs
[2026-01-16 11:00:15] Input PTAU: ../zkproof/build/ptau/pot17_final.ptau
[2026-01-16 11:00:15] Input PTAU: ../zkproof/build/ptau/pot17_final.ptau
[2026-01-16 11:00:15] 
[2026-01-16 11:00:15] 
[2026-01-16 11:00:15] Started file size monitor (PID: 80737)
[2026-01-16 11:00:15] Started file size monitor (PID: 80737)
[2026-01-16 11:00:15] [CMD] snarkjs groth16 setup ../zkproof/build/main.r1cs ../zkproof/build/ptau/pot17_final.ptau ../zkproof/build/circuit_0000.zkey
[2026-01-16 11:00:15] [CMD] snarkjs groth16 setup ../zkproof/build/main.r1cs ../zkproof/build/ptau/pot17_final.ptau ../zkproof/build/circuit_0000.zkey
[2026-01-16 11:00:15] [MONITOR] File size monitor started at Fri Jan 16 11:00:15 EST 2026
[2026-01-16 11:00:15] [MONITOR] File size monitor started at Fri Jan 16 11:00:15 EST 2026
[2026-01-16 11:00:15] 
[2026-01-16 11:00:15] 
[2026-01-16 11:00:15] ========== SNARKJS GROTH16 SETUP OUTPUT START ==========
[2026-01-16 11:00:15] ========== SNARKJS GROTH16 SETUP OUTPUT START ==========
[2026-01-16 11:00:15] 
[2026-01-16 11:00:15] 
[2026-01-16 11:00:15] IMPORTANT INFO FOR 126193 CONSTRAINTS:
[2026-01-16 11:00:15] IMPORTANT INFO FOR 126193 CONSTRAINTS:
[2026-01-16 11:00:15]   - Expected time: 30-60 minutes
[2026-01-16 11:00:15]   - Expected time: 30-60 minutes
[2026-01-16 11:00:15]   - Expected output file size: ~50-100 MB
[2026-01-16 11:00:15]   - Expected output file size: ~50-100 MB
[2026-01-16 11:00:15]   - Monitor progress: watch -n5 'ls -la ../zkproof/build/circuit_0000.zkey'
[2026-01-16 11:00:15]   - Monitor progress: watch -n5 'ls -la ../zkproof/build/circuit_0000.zkey'
[2026-01-16 11:00:15] 
[2026-01-16 11:00:15] 
[2026-01-16 11:00:15] The process will appear to hang with no output - THIS IS NORMAL!
[2026-01-16 11:00:15] The process will appear to hang with no output - THIS IS NORMAL!
[2026-01-16 11:00:15] snarkjs performs heavy computation without intermediate output.
[2026-01-16 11:00:15] snarkjs performs heavy computation without intermediate output.
[2026-01-16 11:00:15] 
[2026-01-16 11:00:15] 
[2026-01-16 11:00:15] snarkjs output file: zkproof/logs/snarkjs_setup_20260116_110015.log
[2026-01-16 11:00:15] snarkjs output file: zkproof/logs/snarkjs_setup_20260116_110015.log
[2026-01-16 11:00:15] 
[2026-01-16 11:00:15] 
[2026-01-16 11:00:15] Starting snarkjs now... (no output expected until completion)
[2026-01-16 11:00:15] Starting snarkjs now... (no output expected until completion)
[2026-01-16 11:00:15] 
[2026-01-16 11:00:15] 
[2026-01-16 11:00:17] [MONITOR] File created, monitoring size...
[2026-01-16 11:00:17] [MONITOR] File created, monitoring size...
[2026-01-16 11:00:17] [MONITOR] [0m 2s] Size: 0 MB (0 KB) | +0 KB since last check
[2026-01-16 11:00:17] [MONITOR] [0m 2s] Size: 0 MB (0 KB) | +0 KB since last check
[2026-01-16 11:00:27] [MONITOR] [0m 12s] Size: 24 MB (24671 KB) | +24670 KB since last check
[2026-01-16 11:00:27] [MONITOR] [0m 12s] Size: 24 MB (24671 KB) | +24670 KB since last check
[2026-01-16 11:00:38] [MONITOR] [0m 23s] Size: 26 MB (27163 KB) | +2492 KB since last check
[2026-01-16 11:00:38] [MONITOR] [0m 23s] Size: 26 MB (27163 KB) | +2492 KB since last check
[2026-01-16 11:00:58] [MONITOR] [0m 43s] Size: 29 MB (30705 KB) | +3541 KB since last check
[2026-01-16 11:00:58] [MONITOR] [0m 43s] Size: 29 MB (30705 KB) | +3541 KB since last check
[2026-01-16 11:01:08] [MONITOR] [0m 53s] Size: 31 MB (32565 KB) | +1859 KB since last check
[2026-01-16 11:01:08] [MONITOR] [0m 53s] Size: 31 MB (32565 KB) | +1859 KB since last check
[2026-01-16 11:01:10] 
[2026-01-16 11:01:10] 
[2026-01-16 11:01:10] snarkjs output (tail):
[2026-01-16 11:01:10] snarkjs output (tail):
[32;22m[INFO]  [39;1msnarkJS[0m: Reading r1cs
[32;22m[INFO]  [39;1msnarkJS[0m: Reading tauG1
[32;22m[INFO]  [39;1msnarkJS[0m: Reading tauG2
[32;22m[INFO]  [39;1msnarkJS[0m: Reading alphatauG1
[32;22m[INFO]  [39;1msnarkJS[0m: Reading betatauG1
[32;22m[INFO]  [39;1msnarkJS[0m: Circuit hash: 
		1ee18325 c94f7b50 4dc366a7 631bf999
		b703ac1a 6e3237d7 37de3563 b5bd3554
		92da2baf 11adf833 d7f0eb94 09e52191
		9e148c14 951589c1 f1a695b2 01fba193
[2026-01-16 11:01:10] 
[2026-01-16 11:01:10] 
[2026-01-16 11:01:10] ========== SNARKJS GROTH16 SETUP OUTPUT END ==========
[2026-01-16 11:01:10] ========== SNARKJS GROTH16 SETUP OUTPUT END ==========
[2026-01-16 11:01:10] 
[2026-01-16 11:01:10] 
[2026-01-16 11:01:10] Stopping file size monitor...
[2026-01-16 11:01:10] Stopping file size monitor...
[2026-01-16 11:01:10] Monitor stopped
[2026-01-16 11:01:10] Monitor stopped
[2026-01-16 11:01:10] [0;32m✓ zkey generated successfully (62 MB / 65682556 bytes)[0m
[2026-01-16 11:01:10] [0;32m✓ zkey generated successfully (62 MB / 65682556 bytes)[0m
[2026-01-16 11:01:10] Step 2.1 complete
[2026-01-16 11:01:10] Step 2.1 complete

[2026-01-16 11:01:10] Final zkey file does not exist, will generate
[2026-01-16 11:01:10] Final zkey file does not exist, will generate
[2026-01-16 11:01:10] [1;33mStep 2.2: Contributing to zkey...[0m
[2026-01-16 11:01:10] [1;33mStep 2.2: Contributing to zkey...[0m
[2026-01-16 11:01:10] Using entropy: random entropy 1768579270
[2026-01-16 11:01:10] Using entropy: random entropy 1768579270
[2026-01-16 11:01:10] [CMD] snarkjs zkey contribute ../zkproof/build/circuit_0000.zkey ../zkproof/build/circuit_final.zkey --name='1st Contributor' -v
[2026-01-16 11:01:10] [CMD] snarkjs zkey contribute ../zkproof/build/circuit_0000.zkey ../zkproof/build/circuit_final.zkey --name='1st Contributor' -v
[36;22m[DEBUG] [39;1msnarkJS[0m: Applying key: L Section: 0/126304
[36;22m[DEBUG] [39;1msnarkJS[0m: Applying key: L Section: 0/126304
[36;22m[DEBUG] [39;1msnarkJS[0m: Applying key: L Section: 65536/126304
[36;22m[DEBUG] [39;1msnarkJS[0m: Applying key: L Section: 65536/126304
[36;22m[DEBUG] [39;1msnarkJS[0m: Applying key: H Section: 0/131072
[36;22m[DEBUG] [39;1msnarkJS[0m: Applying key: H Section: 0/131072
[36;22m[DEBUG] [39;1msnarkJS[0m: Applying key: H Section: 65536/131072
[36;22m[DEBUG] [39;1msnarkJS[0m: Applying key: H Section: 65536/131072
[32;22m[INFO]  [39;1msnarkJS[0m: Circuit Hash: 
		1ee18325 c94f7b50 4dc366a7 631bf999
		b703ac1a 6e3237d7 37de3563 b5bd3554
		92da2baf 11adf833 d7f0eb94 09e52191
		9e148c14 951589c1 f1a695b2 01fba193
[32;22m[INFO]  [39;1msnarkJS[0m: Circuit Hash: 
		1ee18325 c94f7b50 4dc366a7 631bf999
		b703ac1a 6e3237d7 37de3563 b5bd3554
		92da2baf 11adf833 d7f0eb94 09e52191
		9e148c14 951589c1 f1a695b2 01fba193
[32;22m[INFO]  [39;1msnarkJS[0m: Contribution Hash: 
		d0712519 36405516 436f6377 741b687e
		a4a208be 7cb13edd 9b7f12d2 66d7169e
		2aeaff10 c63913bd 3eedbd24 7156a730
		28734b7a 9dde259a 4d362d2c caa690e0
[32;22m[INFO]  [39;1msnarkJS[0m: Contribution Hash: 
		d0712519 36405516 436f6377 741b687e
		a4a208be 7cb13edd 9b7f12d2 66d7169e
		2aeaff10 c63913bd 3eedbd24 7156a730
		28734b7a 9dde259a 4d362d2c caa690e0
[2026-01-16 11:01:36] Step 2.2 complete
[2026-01-16 11:01:36] Step 2.2 complete

[2026-01-16 11:01:36] [1;33mStep 2.3: Exporting verification key...[0m
[2026-01-16 11:01:36] [1;33mStep 2.3: Exporting verification key...[0m
[2026-01-16 11:01:36] [CMD] snarkjs zkey export verificationkey ../zkproof/build/circuit_final.zkey ../zkproof/build/verification_key.json
[2026-01-16 11:01:36] [CMD] snarkjs zkey export verificationkey ../zkproof/build/circuit_final.zkey ../zkproof/build/verification_key.json
[32;22m[INFO]  [39;1msnarkJS[0m: EXPORT VERIFICATION KEY STARTED
[32;22m[INFO]  [39;1msnarkJS[0m: EXPORT VERIFICATION KEY STARTED
[32;22m[INFO]  [39;1msnarkJS[0m: > Detected protocol: groth16
[32;22m[INFO]  [39;1msnarkJS[0m: > Detected protocol: groth16
[32;22m[INFO]  [39;1msnarkJS[0m: EXPORT VERIFICATION KEY FINISHED
[32;22m[INFO]  [39;1msnarkJS[0m: EXPORT VERIFICATION KEY FINISHED
[2026-01-16 11:01:36] [0;32m✓ Verification key exported[0m
[2026-01-16 11:01:36] [0;32m✓ Verification key exported[0m
[2026-01-16 11:01:36] Step 2.3 complete
[2026-01-16 11:01:36] Step 2.3 complete
[2026-01-16 11:01:36] Phase 2 completed
[2026-01-16 11:01:36] Phase 2 completed

================================================
   Phase 3: Generating Solidity Verifier
================================================

[2026-01-16 11:01:36] Phase 3 started
[2026-01-16 11:01:36] Phase 3 started
[2026-01-16 11:01:36] [1;33mStep 3.1: Generating Solidity verifier contract...[0m
[2026-01-16 11:01:36] [1;33mStep 3.1: Generating Solidity verifier contract...[0m
[2026-01-16 11:01:36] Verifier output path: ../contracts/zk/Groth16Verifier.sol
[2026-01-16 11:01:36] Verifier output path: ../contracts/zk/Groth16Verifier.sol
[2026-01-16 11:01:36] [CMD] snarkjs zkey export solidityverifier ../zkproof/build/circuit_final.zkey ../contracts/zk/Groth16Verifier.sol
[2026-01-16 11:01:36] [CMD] snarkjs zkey export solidityverifier ../zkproof/build/circuit_final.zkey ../contracts/zk/Groth16Verifier.sol
[32;22m[INFO]  [39;1msnarkJS[0m: EXPORT VERIFICATION KEY STARTED
[32;22m[INFO]  [39;1msnarkJS[0m: EXPORT VERIFICATION KEY STARTED
[32;22m[INFO]  [39;1msnarkJS[0m: > Detected protocol: groth16
[32;22m[INFO]  [39;1msnarkJS[0m: > Detected protocol: groth16
[32;22m[INFO]  [39;1msnarkJS[0m: EXPORT VERIFICATION KEY FINISHED
[32;22m[INFO]  [39;1msnarkJS[0m: EXPORT VERIFICATION KEY FINISHED
[2026-01-16 11:01:36] [0;32m✓ Solidity verifier generated[0m
[2026-01-16 11:01:36] [0;32m✓ Solidity verifier generated[0m
[2026-01-16 11:01:36] Phase 3 completed
[2026-01-16 11:01:36] Phase 3 completed

================================================
   Setup Summary
================================================
[2026-01-16 11:01:36] Setup completed successfully
[2026-01-16 11:01:36] Setup completed successfully
Generated files:
  - ../zkproof/build/circuit_final.zkey       (Proving key)
  - ../zkproof/build/verification_key.json    (Verification key)
  - ../contracts/zk/Groth16Verifier.sol    (Solidity verifier)

File sizes:
[2026-01-16 11:01:36]   circuit_final.zkey: 62 MB
[2026-01-16 11:01:36]   circuit_final.zkey: 62 MB
[2026-01-16 11:01:36]   verification_key.json: 3841 bytes
[2026-01-16 11:01:36]   verification_key.json: 3841 bytes

[2026-01-16 11:01:36] [0;32m✓ Trusted setup complete![0m
[2026-01-16 11:01:36] [0;32m✓ Trusted setup complete![0m

Log file saved to: zkproof/logs/setup_20260116_105942.log

Next steps:
  1. Generate a proof: npm run zk:generate-proof
  2. Verify the proof: npm run zk:verify-proof
  3. Test on-chain: npx hardhat test test/zk/*.test.js

[2026-01-16 11:01:36] [1;33m⚠ WARNING: This setup is for DEVELOPMENT only[0m
[2026-01-16 11:01:36] [1;33m⚠ WARNING: This setup is for DEVELOPMENT only[0m
For production, conduct a proper multi-party ceremony

[2026-01-16 11:01:36] Setup script finished at Fri Jan 16 11:01:36 EST 2026
[2026-01-16 11:01:36] Setup script finished at Fri Jan 16 11:01:36 EST 2026
